{
  "claim": "declared-contaminated",
  "contentIdentitySha256": "6b55f46f1c62027089f824c39d7ac821fb3a0c8c82d329ca1074e09a1112bd1d",
  "custody": {
    "attestationIdentitySha256": null,
    "separated": false
  },
  "kind": "genesis/genesisbench-contamination-attestation-v0.1",
  "knownExposure": {
    "evidenceIdentitySha256": "d21a9f149fe62e8e4b7bb562a17cb5bd2afeb84447a4b5da1760f6eb0a9c31dd",
    "exposed": true,
    "reasonCodes": [
      "public-reference"
    ]
  },
  "modelRelease": {
    "immutableEvidenceIdentitySha256": null,
    "modelId": "genesis-agent-fixture",
    "modelRevision": "sha256:ea5ae5d06096510cc7eb945a16687f2dfce0e2f1edbc4001ab1c4c07b24be5dd",
    "releasedAt": null
  },
  "runIdentitySha256": "d236258ab5f98d4d5d05ebbf1e11d0220fd6419747062b78e2d3455b4ff991c0",
  "task": {
    "commitmentSnapshotIdentitySha256": null,
    "disclosedAt": null,
    "epochId": null,
    "precommittedAt": null,
    "visibilityClass": "public-development-reference"
  },
  "training": {
    "attestationIdentitySha256": null,
    "cutoffAt": null,
    "nonExposureAttested": false,
    "provenanceComplete": false
  },
  "version": "0.1.0"
}
